{
  "name": "block_maleek_vs_donnell_predictive_movement_prose_10s",
  "schema": "sakuga_Xperiment",
  "fps": 24,
  "duration": 10.0,
  "axes": "Y_up, metres, arena floor y=0, combat pocket z=2.8 to z=5.0, A stays on screen_left facing +Z right for all 10s, B stays on screen_right facing -Z left for all 10s",
  "screen_geometry": "180_degree_camera_hemisphere_locked_for_all_10s: Fighter A remains strictly on screen_left facing right (+Z) and Fighter B remains strictly on screen_right facing left (-Z) for the entire 10.0s clip (zero side swaps).",
  "negative": "no 3D CGI, no mocap stiffness, no floaty physics, no static flat camera, no weapons, no swords, no knives, no side swap, no outfit swap, no torso merging, no chest-to-chest clipping, no on-screen text or numbers, no HUD, no coordinate labels, no extra fighters, no missing limbs, no missing arms, no one-armed fighter, no extra legs, no deformed legs, no full-body blur during smears, no reaction before contact",
  "conservation_laws": [
    "CONSERVE_SEMANTICALLY: every strike, evade, block, and counter is chained so the post-coil of Beat N physically loads the pre-coil of Beat N+1",
    "realistic_strike_reach_spacing: punches connect at one full arm's length (0.75-0.85m), pocket hooks/uppercuts at half an arm's length (0.60-0.65m), and kicks at one full leg's length (1.05-1.15m) with both arms separate from the torso in silhouette",
    "strict_screen_side_and_outfit_lock: A stays on screen_left facing right and B stays on screen_right facing left for all 10.0 seconds",
    "knockback_and_hit_reaction_require_prior_physical_contact_zero_early_flinch"
  ],
  "laban": {
    "A": {
      "fighting_style": "ufc_mma_octagon",
      "chain": "C01_low_calf_kick_0.00s > C02_burst_step_in_0.88s > C03_slashing_rear_elbow_1.76s > C04_high_shell_guard_2.64s > C05_lead_liver_hook_3.52s > C06_single_collar_tie_4.40s > C07_clinch_rising_knee_5.28s > C08_two_hand_clinch_shove_6.16s > C09_body_elbow_tuck_7.04s > C10_spinning_back_kick_8.85s",
      "effort": {
        "weight": "heavy_striker_power",
        "time": "sudden",
        "space": "direct",
        "flow": "bound"
      }
    },
    "B": {
      "fighting_style": "ufc_mma_octagon",
      "chain": "C01_lead_leg_buckle_0.00s > C02_slip_inside_0.88s > C03_head_whip_side_1.76s > C04_cross_2.64s > C05_torso_fold_rib_hit_3.52s > C06_clinch_captured_react_4.40s > C07_clinch_rib_fold_5.28s > C08_shoved_back_react_6.16s > C09_rear_body_straight_7.04s > C10_torso_fold_rib_hit_8.85s",
      "effort": {
        "weight": "heavy_brawler_power",
        "time": "sudden",
        "space": "direct",
        "flow": "bound"
      }
    }
  },
  "beats": [
    "exchange_1_low_calf_kick_vs_lead_leg_buckle",
    "exchange_2_burst_step_in_vs_slip_inside",
    "exchange_3_slashing_rear_elbow_vs_head_whip_side",
    "exchange_4_high_shell_guard_vs_cross",
    "exchange_5_lead_liver_hook_vs_torso_fold_rib_hit",
    "exchange_6_single_collar_tie_vs_clinch_captured_react",
    "exchange_7_clinch_rising_knee_vs_clinch_rib_fold",
    "exchange_8_two_hand_clinch_shove_vs_shoved_back_react",
    "exchange_9_body_elbow_tuck_vs_rear_body_straight",
    "exchange_10_spinning_back_kick_vs_torso_fold_rib_hit"
  ],
  "A_beats": [
    {
      "t": 0.0,
      "beat": "exchange_1_low_calf_kick_vs_lead_leg_buckle",
      "causal": "C01: requires init_stance -> preserves loaded_rear_momentum -> chain: hips snap through the arc > torso whips low > right shin swings flat > right shin digs into the calf -> causes C01_low_calf_kick",
      "pos": [
        0,
        0.84,
        3.2
      ],
      "vel": [
        0,
        0,
        0.3
      ],
      "axis": "head:+Y_up, torso:hip_whip_arc_horizontal, facing:+Z, screen_side:left",
      "arc": "arc_horizontal_rear_leg_at_1.10m_reach",
      "support": "standing_on_arena_floor_at_z=3.20",
      "weight_split": [
        85,
        15
      ],
      "com_position": "over_lead_foot",
      "easing_curve": "snap_snap_hold_snap",
      "impulse_tier": 3,
      "limbs": "L_arm:left hand held high at the brow; R_arm:the right arm swings down-back as a counterbalance (both arms separate from the torso in silhouette); L_leg:left foot pivoted outward as the standing post; R_leg:right shin turning over horizontally into the calf",
      "pose": "At 0.00s (hold 3f), at one full leg's length (1.10m) with 85/15 lead/rear weight split (center of mass stacked over lead foot) and both arms separate from the torso in silhouette, A steps off-line on his left foot and whips a baseball-bat right shin horizontally into the outside of the lead calf.",
      "contact": "pre:A_low_calf_kick_windup -> hit:A_right_shin_calf_kick_into_B_lead_ankle_and_calf_at_[0,0.24,4.18]_at_1.10m_reach -> post:white_impact_shock_triggers_B_lead_leg_buckle"
    },
    {
      "t": 0.88,
      "beat": "exchange_2_burst_step_in_vs_slip_inside",
      "causal": "C02: requires C01_prev_state -> preserves loaded_rear_momentum -> chain: left foot plants inside range > hips surge forward > torso locks over the lead knee -> causes C02_burst_step_in",
      "pos": [
        0,
        0.84,
        3.2
      ],
      "vel": [
        0,
        0,
        0.0
      ],
      "axis": "head:+Y_up, torso:knee_drive_straight, facing:+Z, screen_side:left",
      "arc": "straight_lead_leg_at_1.10m_reach",
      "support": "standing_on_arena_floor_at_z=3.20",
      "weight_split": [
        35,
        65
      ],
      "com_position": "over_rear_foot",
      "easing_curve": "burst_launch_snap_lock",
      "impulse_tier": 0,
      "limbs": "L_arm:left arm held high in a tight guard with elbows tucked; R_arm:right arm held high in a tight guard with elbows tucked (both arms separate from the torso in silhouette); L_leg:left foot stepping briskly forward across the canvas; R_leg:right leg pushing off and sliding up to maintain stance width",
      "pose": "At 0.88s (6f), at one full leg's length (1.10m) with 35/65 lead/rear weight split (center of mass anchored over rear foot) and both arms separate from the torso in silhouette, A drives off his right foot in a sharp forward step to close the gap into striking range."
    },
    {
      "t": 1.76,
      "beat": "exchange_3_slashing_rear_elbow_vs_head_whip_side",
      "causal": "C03: requires C02_prev_state -> preserves loaded_lead_momentum -> chain: hips whip square > torso snaps through the cut > right shoulder drives forward > right elbow lands on the cheekbone -> causes C03_slashing_rear_elbow",
      "pos": [
        0,
        0.84,
        3.2
      ],
      "vel": [
        0,
        0,
        0.3
      ],
      "axis": "head:+Y_up, torso:elbow_flex_arc_horizontal, facing:+Z, screen_side:left",
      "arc": "arc_horizontal_rear_elbow_at_0.80m_reach",
      "support": "standing_on_arena_floor_at_z=3.20",
      "weight_split": [
        30,
        70
      ],
      "com_position": "over_rear_foot",
      "easing_curve": "snap_snap_hold_snap",
      "impulse_tier": 3,
      "limbs": "L_arm:left palm checking the opponent's lead shoulder, both arms clearly separate from the torso; R_arm:steps deep into the pocket and whips a razor-sharp horizontal right elbow point across the brow and cheekbone (both arms separate from the torso in silhouette); L_leg:left foot planted deep inside the pocket; R_leg:right heel pivoting hard to drive the elbow point through",
      "pose": "At 1.76s (hold 3f), at one full arm's length (0.80m) with 30/70 lead/rear weight split (center of mass anchored over rear foot) and both arms separate from the torso in silhouette, A steps deep into the pocket and whips a razor-sharp horizontal right elbow point across the brow and cheekbone.",
      "contact": "pre:A_slashing_rear_elbow_windup -> hit:A_right_elbow_and_forearm_into_B_jawline_and_chin_at_[0,1.44,3.88]_at_0.80m_reach -> post:white_impact_shock_triggers_B_head_whip_side"
    },
    {
      "t": 2.64,
      "beat": "exchange_4_high_shell_guard_vs_cross",
      "causal": "C04: requires C03_prev_state -> preserves recoiling_back_momentum -> chain: hips sink low > torso braces forward > both forearms lock across the face -> causes C04_high_shell_guard",
      "pos": [
        0,
        0.84,
        3.2
      ],
      "vel": [
        0,
        0,
        0.0
      ],
      "axis": "head:+Y_up, torso:elbow_flex_none, facing:+Z, screen_side:left",
      "arc": "none_both_hands_at_0.80m_reach",
      "support": "standing_on_arena_floor_at_z=3.20",
      "weight_split": [
        30,
        70
      ],
      "com_position": "over_rear_foot",
      "easing_curve": "sudden_jolt_settle",
      "impulse_tier": 2,
      "limbs": "L_arm:left arm pressed vertically from jawline to forehead, elbows tucked in; R_arm:right arm pressed vertically from jawline to forehead, elbows tucked in (both arms separate from the torso in silhouette); L_leg:left foot braced forward against the impact; R_leg:right heel digging into the canvas to halt the pushback",
      "pose": "At 2.64s (hold 3f), at one full arm's length (0.80m) with 30/70 lead/rear weight split (center of mass anchored over rear foot) and both arms separate from the torso in silhouette, A locks both forearms tightly in front of his face in a rigid high shell guard to absorb the blow.",
      "contact": "pre:A_high_shell_guard_set -> hit:B_right_fist_cross_meets_A_vertical_forearm_shell_at_[0,1.44,3.32]_at_0.80m_reach -> post:heavy_counter_shock_absorbed_on_A_high_shell_guard"
    },
    {
      "t": 3.52,
      "beat": "exchange_5_lead_liver_hook_vs_torso_fold_rib_hit",
      "causal": "C05: requires C04_prev_state -> preserves loaded_rear_momentum -> chain: hips dip low > torso whips upward > left shoulder drives forward > left fist digs into the ribs -> causes C05_lead_liver_hook",
      "pos": [
        0,
        0.84,
        3.2
      ],
      "vel": [
        0,
        0,
        0.3
      ],